{
  "$schema": "https://json-schema.org/draft/2020-12/schema",
  "$id": "https://arcnexus.local/schemas/assignment-v1",
  "type": "object",
  "properties": {
    "schemaVersion": {
      "enum": [
        1,
        2,
        3
      ]
    },
    "objective": {
      "type": "string",
      "minLength": 1
    },
    "kind": {
      "enum": [
        "change",
        "research",
        "review"
      ]
    },
    "expectedOutcome": {
      "type": "string",
      "minLength": 1
    },
    "acceptanceCriteria": {
      "type": "array",
      "items": {
        "type": "string",
        "minLength": 1
      },
      "uniqueItems": true,
      "minItems": 1
    },
    "allowedWritePaths": {
      "type": "array",
      "items": {
        "type": "string",
        "minLength": 1
      },
      "uniqueItems": true
    },
    "hostChecks": {
      "type": "array",
      "items": {
        "type": "object",
        "properties": {
          "id": {
            "type": "string",
            "minLength": 1,
            "pattern": "^[a-zA-Z0-9_-]+$"
          },
          "command": {
            "type": "string",
            "minLength": 1
          },
          "args": {
            "type": "array",
            "items": {
              "type": "string"
            }
          },
          "artifacts": {
            "type": "array",
            "items": {
              "type": "string",
              "minLength": 1
            },
            "uniqueItems": true
          }
        },
        "required": [
          "id",
          "command",
          "args",
          "artifacts"
        ],
        "additionalProperties": false
      }
    },
    "changeType": {
      "enum": [
        "behavior",
        "documentation"
      ]
    },
    "operationIds": {
      "type": "array",
      "uniqueItems": true,
      "items": {
        "type": "string",
        "minLength": 1
      }
    },
    "priorEvidence": {
      "type": "array",
      "maxItems": 64,
      "items": {
        "type": "object",
        "properties": {
          "path": {
            "type": "string",
            "minLength": 1
          },
          "sourceId": {
            "type": "string",
            "minLength": 1
          },
          "revision": {
            "type": "string",
            "minLength": 1
          },
          "reason": {
            "type": "string",
            "minLength": 1
          }
        },
        "required": [
          "path",
          "sourceId",
          "revision",
          "reason"
        ],
        "additionalProperties": false
      }
    }
  },
  "required": [
    "schemaVersion",
    "objective",
    "kind",
    "expectedOutcome",
    "acceptanceCriteria",
    "hostChecks"
  ],
  "additionalProperties": false,
  "allOf": [
    {
      "if": {
        "properties": {
          "schemaVersion": {
            "const": 1
          }
        }
      },
      "then": {
        "properties": {
          "operationIds": false,
          "priorEvidence": false
        }
      }
    }
  ]
}
