{
  "schemaVersion": 2,
  "kind": "research",
  "objective": "Inspect the Platform artifact-diagnostics responsibility and pinned read-only CLI/SDK owners. Invoke operations.run artifact-diagnostics-tests once to obtain real bound-Bun test feedback. Explain what those archive tests establish and remaining uncertainty; do not edit source or start servers. Complete the checklist with observed evidence.",
  "expectedOutcome": "Inspect the Platform artifact-diagnostics responsibility and pinned read-only CLI/SDK owners. Invoke operations.run artifact-diagnostics-tests once to obtain real bound-Bun test feedback. Explain what those archive tests establish and remaining uncertainty; do not edit source or start servers. Complete the checklist with observed evidence.",
  "acceptanceCriteria": [
    "Use the declared artifact-diagnostics-tests operation and report real output.",
    "Explain repository ownership and diagnostic behavior from actual files and tests, with evidence and uncertainty."
  ],
  "hostChecks": []
}
